,text,favorited,favoriteCount,replyToSN,created,truncated,replyToSID,id,replyToUID,statusSource,screenName,retweetCount,isRetweet,retweeted,longitude,latitude,Compound,Positive,Negative,Neutral
2368," Veterans and their families can now apply for emergency financial help.

Call, visit or apply online: ",False,0,,2018-04-10 18:59:19,False,,983781489149083648,,"<a href=""http://twitter.com"" rel=""nofollow"">Twitter Web Client</a>",JustinTrudeau,61,True,False,,,0.0258,0.14,0.135,0.725
2369," Les Véterans et leurs familles peuvent maintenant faire demande pour de l'aide financiere urgente.

Pour faire demande vo",False,0,,2018-04-10 18:59:15,False,,983781473676341248,,"<a href=""http://twitter.com"" rel=""nofollow"">Twitter Web Client</a>",JustinTrudeau,16,True,False,,,0.0,0.0,0.0,1.0
2370, Do you remember the sassy robot Rosie from the Jetson's?  is bringing her to life at their ROSIE Lab! These researc,False,0,,2018-04-10 14:15:52,False,,983710155991896064,,"<a href=""http://twitter.com"" rel=""nofollow"">Twitter Web Client</a>",JustinTrudeau,44,True,False,,,0.0,0.0,0.0,1.0
2371, Souvenez-vous de Rosie - le robot audacieux des Jetson?  lui donne la vie dans leur laboratoire ROSIE! Ces chercheu,False,0,,2018-04-10 14:15:48,False,,983710141043396608,,"<a href=""http://twitter.com"" rel=""nofollow"">Twitter Web Client</a>",JustinTrudeau,13,True,False,,,0.0,0.0,0.0,1.0
2372," Aujourdhui, nous confirmons que le projet de prolongement de la #LigneBleue sera réalisé, avec la participation financier",False,0,,2018-04-09 22:29:18,False,,983471946129010688,,"<a href=""http://twitter.com/download/iphone"" rel=""nofollow"">Twitter for iPhone</a>",JustinTrudeau,51,True,False,,,0.0,0.0,0.0,1.0
2373,"Canadians need good, reliable transit to get them to work on time in the morning and home safely at night. Today in ",False,1273,,2018-04-09 22:11:01,True,,983467343618584577,,"<a href=""http://twitter.com/download/iphone"" rel=""nofollow"">Twitter for iPhone</a>",JustinTrudeau,185,False,False,,,0.7269,0.234,0.0,0.766
2374,Les Canadiens ont besoin de réseaux de transport fiables pour se rendre au travail et chez eux a lheure et en sécu ,False,274,,2018-04-09 22:10:18,True,,983467162043006977,,"<a href=""http://twitter.com/download/iphone"" rel=""nofollow"">Twitter for iPhone</a>",JustinTrudeau,50,False,False,,,0.0,0.0,0.0,1.0
2375," Live from Montréal: Prime Minister Justin Trudeau makes an announcement with the Premier of Quebec, Philippe Couillard. htt",False,0,,2018-04-09 18:12:55,False,,983407423888248832,,"<a href=""http://twitter.com"" rel=""nofollow"">Twitter Web Client</a>",JustinTrudeau,46,True,False,,,0.0,0.0,0.0,1.0
2376," En direct de Montréal: le premier ministre Justin Trudeau effectue une annonce en compagnie du premier ministre du Québec,",False,0,,2018-04-09 18:12:46,False,,983407385128722433,,"<a href=""http://twitter.com"" rel=""nofollow"">Twitter Web Client</a>",JustinTrudeau,19,True,False,,,0.0,0.0,0.0,1.0
2377," On April 9, 1917, the four divisions of the Canadian Corps fought for the first time together and captured #Vimy Ridge  on",False,0,,2018-04-09 13:56:28,False,,983342888863059969,,"<a href=""http://twitter.com"" rel=""nofollow"">Twitter Web Client</a>",JustinTrudeau,706,True,False,,,-0.3182,0.0,0.095,0.905
2378," Le 9 avril 1917, les quatre divisions du Corps canadien ont combattu pour la premiere fois côte a côte et ont capturé la cr",False,0,,2018-04-09 13:56:24,False,,983342869045039104,,"<a href=""http://twitter.com"" rel=""nofollow"">Twitter Web Client</a>",JustinTrudeau,69,True,False,,,0.0,0.0,0.0,1.0
2379,"Today, we honour the great courage and sacrifice of those who fought at Vimy Ridge, and pay tribute to every Canadi ",False,4271,,2018-04-09 12:27:32,True,,983320504089034752,,"<a href=""http://twitter.com/download/iphone"" rel=""nofollow"">Twitter for iPhone</a>",JustinTrudeau,976,False,False,,,0.8519,0.358,0.121,0.521
2380,"Aujourdhui, nous soulignons le grand courage et les sacrifices de ceux qui se sont battus sur la crete de Vimy et ",False,417,,2018-04-09 12:27:13,True,,983320424275562496,,"<a href=""http://twitter.com/download/iphone"" rel=""nofollow"">Twitter for iPhone</a>",JustinTrudeau,85,False,False,,,0.7351,0.246,0.0,0.754
2381,"Tonight we pay tribute. To the team, to the families, to the community: The whole country is behind you. You are lo ",False,8353,,2018-04-09 01:03:17,True,,983148307164815360,,"<a href=""http://twitter.com"" rel=""nofollow"">Twitter Web Client</a>",JustinTrudeau,1653,False,False,,,-0.1027,0.0,0.062,0.938
2382,"Ce soir, nous honorons leur mémoire. A léquipe, aux familles, a la communauté : le pays tout entier est derriere v ",False,514,,2018-04-09 01:02:47,True,,983148183994839040,,"<a href=""http://twitter.com"" rel=""nofollow"">Twitter Web Client</a>",JustinTrudeau,102,False,False,,,-0.128,0.0,0.07,0.93
2383, Her Majesty The Queen has sent this message to the families of the victims of the recent bus crash in Canada. Read the ful,False,0,,2018-04-09 00:50:21,False,,983145053051797504,,"<a href=""http://twitter.com/download/iphone"" rel=""nofollow"">Twitter for iPhone</a>",JustinTrudeau,2401,True,False,,,-0.6124,0.0,0.185,0.815
2384, Le prince Philip et moi avons été profondément attristés en apprenant la nouvelle du tres grave accident dont a été victi,False,0,,2018-04-09 00:50:18,False,,983145042624765952,,"<a href=""http://twitter.com/download/iphone"" rel=""nofollow"">Twitter for iPhone</a>",JustinTrudeau,152,True,False,,,-0.6908,0.0,0.231,0.769
2385,"Canada is a country of the rule of law, and the federal government will act in the national interest. Access to wor ",False,3356,,2018-04-09 00:20:12,True,,983137468047347712,,"<a href=""http://twitter.com"" rel=""nofollow"">Twitter Web Client</a>",JustinTrudeau,860,False,False,,,0.4588,0.125,0.0,0.875
2386,"Le Canada est un pays ou regne la primauté du droit, et le gouvernement fédéral agira dans lintéret national. Lac ",False,265,,2018-04-09 00:19:30,True,,983137289487470592,,"<a href=""http://twitter.com"" rel=""nofollow"">Twitter Web Client</a>",JustinTrudeau,59,False,False,,,0.0,0.0,0.0,1.0
2387, Canada condemns reported chemical attack in eastern Ghouta ,False,0,,2018-04-08 20:38:53,False,,983081771246878720,,"<a href=""http://twitter.com/download/iphone"" rel=""nofollow"">Twitter for iPhone</a>",JustinTrudeau,304,True,False,,,-0.7506,0.0,0.516,0.484
2388, Le Canada condamne lattaque chimique signalée dans la Ghouta orientale ,False,0,,2018-04-08 20:38:49,False,,983081755254054913,,"<a href=""http://twitter.com/download/iphone"" rel=""nofollow"">Twitter for iPhone</a>",JustinTrudeau,63,True,False,,,0.0,0.0,0.0,1.0
2389,"Sending my best wishes for renewal, hope and peace for Orthodox Christians celebrating Easter today. ",False,2190,,2018-04-08 13:12:45,False,,982969496657784832,,"<a href=""http://twitter.com/download/iphone"" rel=""nofollow"">Twitter for iPhone</a>",JustinTrudeau,349,False,False,,,0.9423,0.614,0.0,0.386
2390,Joyeuse Pâque a tous les chrétiens orthodoxes! ,False,471,,2018-04-08 13:06:38,False,,982967956723318784,,"<a href=""http://twitter.com/download/iphone"" rel=""nofollow"">Twitter for iPhone</a>",JustinTrudeau,77,False,False,,,0.0,0.0,0.0,1.0
2391,"On behalf of Canadians, I want to express my thanks for the kind messages weve gotten from leaders around the worl ",False,20273,,2018-04-07 21:24:15,True,,982730797617594368,,"<a href=""http://twitter.com/download/iphone"" rel=""nofollow"">Twitter for iPhone</a>",JustinTrudeau,2503,False,False,,,0.765,0.297,0.0,0.703
2392,"Au nom des Canadiens, je remercie les dirigeants du monde entier de leurs précieux messages. Je les ai transmis au ",False,1007,,2018-04-07 21:23:53,True,,982730707641368576,,"<a href=""http://twitter.com/download/iphone"" rel=""nofollow"">Twitter for iPhone</a>",JustinTrudeau,159,False,False,,,0.0,0.0,0.0,1.0
2393," Je remercie également la  Craft ainsi que les gouverneurs  et , q ",False,509,JustinTrudeau,2018-04-07 20:11:43,True,9.827110660219372e+17,982712547328471040,14260960.0,"<a href=""http://twitter.com/download/iphone"" rel=""nofollow"">Twitter for iPhone</a>",JustinTrudeau,41,False,False,,,0.0,0.0,0.0,1.0
2394," I also want to thank  Craft and Governors  and , whove taken the ",False,1428,JustinTrudeau,2018-04-07 20:05:50,True,9.827080694475612e+17,982711066021937152,14260960.0,"<a href=""http://twitter.com/download/iphone"" rel=""nofollow"">Twitter for iPhone</a>",JustinTrudeau,114,False,False,,,0.4215,0.257,0.0,0.743
2395," Thank you, Mr. President, for your warm words and support. Canadians know our friends in the US ar ",False,3370,realDonaldTrump,2018-04-07 19:53:56,True,9.826732237194895e+17,982708069447561216,25073877.0,"<a href=""http://twitter.com/download/iphone"" rel=""nofollow"">Twitter for iPhone</a>",JustinTrudeau,359,False,False,,,0.8481,0.421,0.0,0.579
2396,"To the entire Humboldt Broncos hockey community: We are here for you. As neighbours, as friends, and as Canadians, ",False,12467,,2018-04-07 18:37:46,True,,982688902598180864,,"<a href=""http://twitter.com/download/iphone"" rel=""nofollow"">Twitter for iPhone</a>",JustinTrudeau,3218,False,False,,,0.4767,0.147,0.0,0.853
2397,"A toute la communauté du hockey des Broncos de Humboldt : nous sommes a vos côtés. En tant que voisins, amis et con ",False,857,,2018-04-07 18:37:05,True,,982688732082876416,,"<a href=""http://twitter.com/download/iphone"" rel=""nofollow"">Twitter for iPhone</a>",JustinTrudeau,210,False,False,,,0.0,0.0,0.0,1.0
2398,Je ne peux imaginer ce que peuvent vivre ces parents... je suis de tout cour avec toutes les personnes éprouvées pa ,False,1059,,2018-04-07 03:45:39,True,,982464394889084928,,"<a href=""http://twitter.com/download/iphone"" rel=""nofollow"">Twitter for iPhone</a>",JustinTrudeau,335,False,False,,,-0.128,0.0,0.07,0.93
2399," Words can not describe the loss that we feel tonight.

From a grieving province, thank you to first responders &amp; medic",False,0,,2018-04-07 03:34:24,False,,982461562026774528,,"<a href=""http://twitter.com/download/iphone"" rel=""nofollow"">Twitter for iPhone</a>",JustinTrudeau,1937,True,False,,,0.0418,0.173,0.128,0.699
2400,"I cannot imagine what these parents are going through, and my heart goes out to everyone affected by this terrible ",False,15277,,2018-04-07 03:33:39,True,,982461375132811271,,"<a href=""http://twitter.com/download/iphone"" rel=""nofollow"">Twitter for iPhone</a>",JustinTrudeau,3764,False,False,,,0.128,0.162,0.181,0.656
2401,Excellent to meet with First Nations and Métis leaders here in Fort McMurray today. Our government is committed to ,False,927,,2018-04-07 01:41:31,True,,982433153309491200,,"<a href=""http://twitter.com/download/iphone"" rel=""nofollow"">Twitter for iPhone</a>",JustinTrudeau,166,False,False,,,0.7003,0.254,0.0,0.746
2402,"Excellente réunion aujourdhui avec des dirigeants métis et des Premieres Nations ici, a Fort McMurray. Notre gouve ",False,229,,2018-04-07 01:41:19,True,,982433103183425536,,"<a href=""http://twitter.com/download/iphone"" rel=""nofollow"">Twitter for iPhone</a>",JustinTrudeau,32,False,False,,,0.0,0.0,0.0,1.0
2403,My thanks to Wood Buffalo mayor  for the very productive meeting on how we can work together to keep w ,False,456,,2018-04-07 01:00:49,True,,982422912828293120,,"<a href=""http://twitter.com/download/iphone"" rel=""nofollow"">Twitter for iPhone</a>",JustinTrudeau,81,False,False,,,0.4404,0.132,0.0,0.868
2404,Merci au maire de Wood Buffalo  pour la réunion tres productive sur la poursuite des efforts de rétabl ,False,166,,2018-04-07 01:00:30,True,,982422831001550849,,"<a href=""http://twitter.com/download/iphone"" rel=""nofollow"">Twitter for iPhone</a>",JustinTrudeau,25,False,False,,,0.0,0.0,0.0,1.0
2405,"Roundtable with business leaders from the energy sector in Alberta this afternoon in Fort McMurray, focused on the ",False,620,,2018-04-07 00:37:56,True,,982417152379531265,,"<a href=""http://twitter.com/download/iphone"" rel=""nofollow"">Twitter for iPhone</a>",JustinTrudeau,111,False,False,,,0.5719,0.227,0.0,0.773
2406,"Table ronde avec des chefs dentreprise du secteur de lénergie de lAlberta cet apres-midi, a Fort McMurray, sur l ",False,182,,2018-04-07 00:37:41,True,,982417092136681472,,"<a href=""http://twitter.com/download/iphone"" rel=""nofollow"">Twitter for iPhone</a>",JustinTrudeau,24,False,False,,,0.4588,0.143,0.0,0.857
2407, Attacks such as this on the Sikh community are unacceptable and need to be condemned as loudly as possible. I stand with,False,0,,2018-04-06 23:19:14,False,,982397349300326401,,"<a href=""http://twitter.com/download/iphone"" rel=""nofollow"">Twitter for iPhone</a>",JustinTrudeau,287,True,False,,,-0.8316,0.0,0.317,0.683
2408,"Great to talk with  oilsands staff at Fort Hills, Alberta today. Were working to get the TMX pipeline proje ",False,794,,2018-04-06 22:37:51,True,,982386934017212416,,"<a href=""http://twitter.com/download/iphone"" rel=""nofollow"">Twitter for iPhone</a>",JustinTrudeau,153,False,False,,,0.6249,0.186,0.0,0.814
2409,J'ai eu le plaisir aujourd'hui de m'entretenir avec les employés de la mine de sables bitumineux de  a Fort ,False,224,,2018-04-06 22:37:22,True,,982386810729803776,,"<a href=""http://twitter.com/download/iphone"" rel=""nofollow"">Twitter for iPhone</a>",JustinTrudeau,28,False,False,,,0.0,0.0,0.0,1.0
2410," Today, our president &amp; CEO Steve Williams hosted  on a tour of the Fort Hills project. Steve and the Prime Minist",False,0,,2018-04-06 21:01:05,False,,982362582139973633,,"<a href=""http://twitter.com"" rel=""nofollow"">Twitter Web Client</a>",JustinTrudeau,84,True,False,,,0.0,0.0,0.0,1.0
2411,What a way to go out. Best wishes to the Sedin brothers on their retirement - thank you for everything youve done ,False,6020,,2018-04-06 19:03:16,True,,982332932525178880,,"<a href=""http://twitter.com"" rel=""nofollow"">Twitter Web Client</a>",JustinTrudeau,1005,False,False,,,0.8074,0.304,0.0,0.696
2412,Quelle belle façon de tirer sa révérence. Bonne chance aux freres Sedin a loccasion de leur départ a la retraite  ,False,290,,2018-04-06 19:02:53,True,,982332834726625281,,"<a href=""http://twitter.com"" rel=""nofollow"">Twitter Web Client</a>",JustinTrudeau,40,False,False,,,0.25,0.091,0.0,0.909
2413, Min Goodale  Canadians expect to receive info on #emergencies quickly and efficiently  wireless alerts will ensure eve,False,0,,2018-04-06 16:23:17,False,,982292670537060353,,"<a href=""http://twitter.com"" rel=""nofollow"">Twitter Web Client</a>",JustinTrudeau,97,True,False,,,0.6486,0.238,0.0,0.762
2414, Min. Goodale  Les Canadiens sattendent a recevoir des renseignements sur les #urgences rapidement et efficacement ,False,0,,2018-04-06 16:23:14,False,,982292656284823552,,"<a href=""http://twitter.com"" rel=""nofollow"">Twitter Web Client</a>",JustinTrudeau,16,True,False,,,0.0,0.0,0.0,1.0
2415,Jonathan Pitre was a hero in every sense of the word - a courageous and determined fighter who persisted in the fac ,False,12171,,2018-04-06 14:02:05,True,,982257137001709571,,"<a href=""http://twitter.com/download/iphone"" rel=""nofollow"">Twitter for iPhone</a>",JustinTrudeau,2338,False,False,,,0.875,0.379,0.0,0.621
2416,Jonathan Pitre était un héros dans tous les sens du terme  un combattant courageux et déterminé qui est resté inéb ,False,521,,2018-04-06 14:00:24,True,,982256713255415811,,"<a href=""http://twitter.com/download/iphone"" rel=""nofollow"">Twitter for iPhone</a>",JustinTrudeau,99,False,False,,,0.0,0.0,0.0,1.0
2417,Canadas clean tech industry is booming and we need to do everything we can to help our companies succeed on the wo ,False,1474,,2018-04-06 03:55:41,True,,982104529956093952,,"<a href=""http://twitter.com/download/iphone"" rel=""nofollow"">Twitter for iPhone</a>",JustinTrudeau,261,False,False,,,0.8225,0.312,0.0,0.688
2418,"Lindustrie canadienne des technologies propres est en plein essor, et nous devons aider nos entreprises a réussir ",False,279,,2018-04-06 03:53:57,True,,982104096554405888,,"<a href=""http://twitter.com/download/iphone"" rel=""nofollow"">Twitter for iPhone</a>",JustinTrudeau,42,False,False,,,0.0,0.0,0.0,1.0
2419,"Our Oceans Protection Plan is an historic, world-class investment in marine protection &amp; spill prevention - helping ",False,1258,,2018-04-06 02:02:36,True,,982076072844931072,,"<a href=""http://twitter.com/download/iphone"" rel=""nofollow"">Twitter for iPhone</a>",JustinTrudeau,241,False,False,,,0.296,0.121,0.0,0.879
2420,Le Plan de protection des océans est un investissement historique dans la protection maritime et la prévention des ,False,257,,2018-04-06 02:01:58,True,,982075914329587712,,"<a href=""http://twitter.com/download/iphone"" rel=""nofollow"">Twitter for iPhone</a>",JustinTrudeau,28,False,False,,,0.0,0.0,0.0,1.0
2421," Today, the CCGS Sir Wilfrid Laurier crew welcomed the  in #Victoria, #BC. #CCGProud to support government pri",False,0,,2018-04-06 01:25:11,False,,982066658658344960,,"<a href=""http://twitter.com/download/iphone"" rel=""nofollow"">Twitter for iPhone</a>",JustinTrudeau,86,True,False,,,0.6249,0.254,0.0,0.746
2422, Léquipage du NGCC Sir Wilfrid Laurier a accueilli le  a Victoria C.-B. #GCCFiere de contribuer aux priorit,False,0,,2018-04-06 01:25:02,False,,982066618371985409,,"<a href=""http://twitter.com/download/iphone"" rel=""nofollow"">Twitter for iPhone</a>",JustinTrudeau,24,True,False,,,0.0,0.0,0.0,1.0
2423, Introducing the 24 new #Canada150 Research Chairs - a huge brain gain for Canada! ,False,0,,2018-04-05 20:09:10,False,,981987126349885440,,"<a href=""http://twitter.com"" rel=""nofollow"">Twitter Web Client</a>",JustinTrudeau,90,True,False,,,0.7177,0.333,0.0,0.667
2424, Voici les 24 titulaires des nouvelles chaires de recherche #Canada150  un afflux de cerveaux considérable pour le Canad,False,0,,2018-04-05 20:09:01,False,,981987092388614145,,"<a href=""http://twitter.com"" rel=""nofollow"">Twitter Web Client</a>",JustinTrudeau,15,True,False,,,0.0,0.0,0.0,1.0
2425," <U+0001F1E8><U+0001F1E6> has the longest coastline in the world, which is why we need a world-leading marine safety system that provides econo",False,0,,2018-04-05 19:18:56,False,,981974486919663616,,"<a href=""http://twitter.com"" rel=""nofollow"">Twitter Web Client</a>",JustinTrudeau,132,True,False,,,0.4215,0.123,0.0,0.877
2426," Le <U+0001F1E8><U+0001F1E6> a le plus long littoral au monde, cest pourquoi nous avons besoin d'un systeme de sécurité maritime de calibre mo",False,0,,2018-04-05 19:18:47,False,,981974447472173059,,"<a href=""http://twitter.com"" rel=""nofollow"">Twitter Web Client</a>",JustinTrudeau,26,True,False,,,0.0,0.0,0.0,1.0
2427,"Heading to Victoria, Vancouver, and Fort McMurray. Well be highlighting how our world leading Oceans Protection Pl ",False,2053,,2018-04-05 19:02:23,True,,981970323053527040,,"<a href=""http://twitter.com/download/iphone"" rel=""nofollow"">Twitter for iPhone</a>",JustinTrudeau,297,False,False,,,0.0,0.0,0.0,1.0
2428,"Nous visiterons Victoria, Vancouver et Fort McMurray pour illustrer comment notre Plan de protection des océans de ",False,320,,2018-04-05 19:01:49,True,,981970180954730496,,"<a href=""http://twitter.com/download/iphone"" rel=""nofollow"">Twitter for iPhone</a>",JustinTrudeau,47,False,False,,,0.0,0.0,0.0,1.0
2429,"Started the day in Quebec City, speaking with B7 business leaders including the  about working toge ",False,561,,2018-04-05 17:41:04,True,,981949859019264000,,"<a href=""http://twitter.com"" rel=""nofollow"">Twitter Web Client</a>",JustinTrudeau,106,False,False,,,0.0,0.0,0.0,1.0
2430,"Jai commencé la journée a Québec, ou des chefs dentreprise du B7, dont , et moi avons parlé de ma ",False,232,,2018-04-05 17:40:06,True,,981949612511592448,,"<a href=""http://twitter.com"" rel=""nofollow"">Twitter Web Client</a>",JustinTrudeau,31,False,False,,,0.0,0.0,0.0,1.0
2431, Le Canada est bien représenté au Sommet du B7 ! Tres fiere d'y etre avec mes coprésidents et le Premier ministre ,False,0,,2018-04-05 15:23:40,False,,981915280959000576,,"<a href=""http://twitter.com"" rel=""nofollow"">Twitter Web Client</a>",JustinTrudeau,23,True,False,,,0.0,0.0,0.0,1.0
2432, Canada is well represented at the B7 ! Proud to be there with my co-chairs and Prime Minister  ! #B7Canad,False,0,,2018-04-05 15:23:37,False,,981915268707487746,,"<a href=""http://twitter.com"" rel=""nofollow"">Twitter Web Client</a>",JustinTrudeau,39,True,False,,,0.6988,0.243,0.0,0.757
2433,Our Veterans were there for Canada when we needed them - and we must always be there for them. ,False,1394,,2018-04-05 02:30:20,False,,981720662703144965,,"<a href=""http://twitter.com/download/iphone"" rel=""nofollow"">Twitter for iPhone</a>",JustinTrudeau,282,False,False,,,0.0,0.0,0.0,1.0
2434,Nos anciens combattants ont été la pour le Canada quand nous en avons eu besoin - et nous devons toujours etre la p ,False,198,,2018-04-05 02:30:03,True,,981720591852949504,,"<a href=""http://twitter.com/download/iphone"" rel=""nofollow"">Twitter for iPhone</a>",JustinTrudeau,34,False,False,,,0.0,0.0,0.0,1.0
2435,"We can achieve a lot when we work together with labour &amp; business - this afternoon, I met with L7 labour leaders to ",False,656,,2018-04-05 02:17:40,True,,981717476529455104,,"<a href=""http://twitter.com/download/iphone"" rel=""nofollow"">Twitter for iPhone</a>",JustinTrudeau,133,False,False,,,0.0,0.0,0.0,1.0
2436,"Nous pouvons réaliser beaucoup de choses en travaillant avec les syndicats et le patronat  aujourdhui, jai renco ",False,209,,2018-04-05 02:17:11,True,,981717353036574720,,"<a href=""http://twitter.com/download/iphone"" rel=""nofollow"">Twitter for iPhone</a>",JustinTrudeau,35,False,False,,,0.0,0.0,0.0,1.0
2437,Kicking off s #DaffodilMonth with Tyra and Sabrina in Ottawa this morning. Find out how you can ,False,881,,2018-04-05 02:07:19,True,,981714870931304448,,"<a href=""http://twitter.com/download/iphone"" rel=""nofollow"">Twitter for iPhone</a>",JustinTrudeau,166,False,False,,,0.0,0.0,0.0,1.0
2438,Lancement du #MoisDeLaJonquille de la  avec Tyra et Sabrina a Ottawa ce matin. #JoignezVousAuCombat cont ,False,292,,2018-04-05 02:06:37,True,,981714695324254208,,"<a href=""http://twitter.com/download/iphone"" rel=""nofollow"">Twitter for iPhone</a>",JustinTrudeau,50,False,False,,,0.0,0.0,0.0,1.0
2439,"On Easter Sunday, a day of celebration for Christians, two churches in Halifax were vandalised. This type of hatefu ",False,2781,,2018-04-05 01:36:50,True,,981707198576312320,,"<a href=""http://twitter.com/download/iphone"" rel=""nofollow"">Twitter for iPhone</a>",JustinTrudeau,491,False,False,,,0.0,0.0,0.0,1.0
2440,"Le dimanche de Pâques, jour de fete pour les chrétiens, deux églises dHalifax ont été vandalisées. Les comportemen ",False,254,,2018-04-05 01:36:07,True,,981707021631111168,,"<a href=""http://twitter.com/download/iphone"" rel=""nofollow"">Twitter for iPhone</a>",JustinTrudeau,52,False,False,,,0.0,0.0,0.0,1.0
2441, Today marks 69 years since the Washington Treaty was signed and #NATO was founded. Since then we have stood together -,False,0,,2018-04-05 00:47:11,False,,981694706361950209,,"<a href=""http://twitter.com/download/iphone"" rel=""nofollow"">Twitter for iPhone</a>",JustinTrudeau,256,True,False,,,0.0,0.0,0.0,1.0
2442,Canada has always been a strong  member - and will continue to be. Thanks to  for the meeting ,False,1196,,2018-04-05 00:33:54,True,,981691361370882048,,"<a href=""http://twitter.com/download/iphone"" rel=""nofollow"">Twitter for iPhone</a>",JustinTrudeau,282,False,False,,,0.7351,0.279,0.0,0.721
2443,Le Canada a toujours été et continuera d'etre un membre solide de . Merci a  de nous avoir ren ,False,160,,2018-04-05 00:33:28,True,,981691255259250688,,"<a href=""http://twitter.com/download/iphone"" rel=""nofollow"">Twitter for iPhone</a>",JustinTrudeau,21,False,False,,,0.0,0.0,0.0,1.0
2444," To recognize the role that caregivers can play in the lives of Veterans, we introduced the $1,000/month Caregiver Recogni",False,0,,2018-04-04 20:58:17,False,,981637099165241345,,"<a href=""http://twitter.com"" rel=""nofollow"">Twitter Web Client</a>",JustinTrudeau,77,True,False,,,0.34,0.118,0.0,0.882
2445," Afin de reconnaître les contributions fait par les aidants dans la vie des Vétérans , nous avons mis en place une allocat",False,0,,2018-04-04 20:58:04,False,,981637046069596161,,"<a href=""http://twitter.com"" rel=""nofollow"">Twitter Web Client</a>",JustinTrudeau,14,True,False,,,0.0,0.0,0.0,1.0
2446,"Next week, Ill travel to Lima, Peru for  before heading to Europe for an official visit to France a ",False,787,,2018-04-04 20:28:48,True,,981629683405082624,,"<a href=""http://twitter.com"" rel=""nofollow"">Twitter Web Client</a>",JustinTrudeau,152,False,False,,,0.0,0.0,0.0,1.0
2447,"Je me rendrai a Lima, au Pérou, la semaine prochaine pour participer au  avant de quitter pour lEur ",False,223,,2018-04-04 20:28:17,True,,981629550672207872,,"<a href=""http://twitter.com"" rel=""nofollow"">Twitter Web Client</a>",JustinTrudeau,52,False,False,,,0.0,0.0,0.0,1.0
2448, I am pleased to see continued progress in March 2018. We remain on track in our commitment to lifting all long-term drinki,False,0,,2018-04-04 19:40:09,False,,981617436180041731,,"<a href=""http://twitter.com"" rel=""nofollow"">Twitter Web Client</a>",JustinTrudeau,68,True,False,,,0.8074,0.304,0.0,0.696
2449, Ravie que quatre #PremieresNations aient pu lever les avis concernant la qualité de leau potable a long terme. Nous de,False,0,,2018-04-04 19:40:02,False,,981617409588125697,,"<a href=""http://twitter.com"" rel=""nofollow"">Twitter Web Client</a>",JustinTrudeau,21,True,False,,,-0.2732,0.0,0.1,0.9
