,text,favorited,favoriteCount,replyToSN,created,truncated,replyToSID,id,replyToUID,statusSource,screenName,retweetCount,isRetweet,retweeted,longitude,latitude,Compound,Positive,Negative,Neutral
815, L'accord signé par le Min Benoit Bourque et moi-meme consacrera des ressources aux développement de nouveaux traitements e,False,0,,2018-08-16 20:52:23,False,,1030195589479313408,,"<a href=""http://twitter.com"" rel=""nofollow"">Twitter Web Client</a>",JustinTrudeau,13,True,False,,,0.0,0.0,0.0,1.0
816,Merci de mavoir accueilli aujourdhui et detre un pilier de la communauté. Le travail que vous faites tous les jo ,False,383,,2018-08-16 20:27:39,True,,1030189367791419397,,"<a href=""http://twitter.com"" rel=""nofollow"">Twitter Web Client</a>",JustinTrudeau,50,False,False,,,0.0,0.0,0.0,1.0
817,"Congratulations, Natan, on your re-election as President of . Looking forward to building on the wo ",False,943,,2018-08-16 19:20:59,True,,1030172587022839809,,"<a href=""http://twitter.com"" rel=""nofollow"">Twitter Web Client</a>",JustinTrudeau,155,False,False,,,0.5994,0.206,0.0,0.794
818,"Félicitations, Natan, pour votre réélection au poste de président d. Jai bien hâte de poursuivre ",False,219,,2018-08-16 19:20:37,True,,1030172495805116418,,"<a href=""http://twitter.com"" rel=""nofollow"">Twitter Web Client</a>",JustinTrudeau,32,False,False,,,0.0,0.0,0.0,1.0
819, Pleased to announce that the #GoC has reached an agreement with #PEI to invest over $366M in infrastructure that will cre,False,0,,2018-08-16 14:41:13,False,,1030102184569004032,,"<a href=""http://twitter.com"" rel=""nofollow"">Twitter Web Client</a>",JustinTrudeau,37,True,False,,,0.7579,0.294,0.0,0.706
820, Heureux d'annoncer que le #GC a conclu une entente avec #PEI pour investir + 366 M$ en infrastructure afin de créer des c,False,0,,2018-08-16 14:41:06,False,,1030102153791250433,,"<a href=""http://twitter.com"" rel=""nofollow"">Twitter Web Client</a>",JustinTrudeau,11,True,False,,,0.0,0.0,0.0,1.0
821,"Busy day in Val-dOr, Malartic &amp; Rouyn-Noranda, QC today, meeting with people to talk about the investments were m ",False,1426,,2018-08-16 01:47:57,True,,1029907586223620097,,"<a href=""http://twitter.com/download/iphone"" rel=""nofollow"">Twitter for iPhone</a>",JustinTrudeau,237,False,False,,,0.0,0.0,0.0,1.0
822,"Journée chargée a Val-dOr, Malartic et Rouyn-Noranda (QC) aujourdhui. Au programme : les investissements que nous ",False,350,,2018-08-16 01:46:59,True,,1029907339707641857,,"<a href=""http://twitter.com/download/iphone"" rel=""nofollow"">Twitter for iPhone</a>",JustinTrudeau,53,False,False,,,0.0,0.0,0.0,1.0
823,Merci de mavoir accueilli! ,False,379,,2018-08-15 23:08:12,False,,1029867379956883456,,"<a href=""http://twitter.com/download/iphone"" rel=""nofollow"">Twitter for iPhone</a>",JustinTrudeau,35,False,False,,,0.0,0.0,0.0,1.0
824,"Our greatest resource is our people  like the hard-working staff at , one of Canadas largest gold mi ",False,1368,,2018-08-15 22:28:24,True,,1029857365464674304,,"<a href=""http://twitter.com/download/iphone"" rel=""nofollow"">Twitter for iPhone</a>",JustinTrudeau,272,False,False,,,0.7717,0.283,0.0,0.717
825,"Nos gens sont notre plus grande ressource  comme les travailleurs de la , lune des plus grandes mine ",False,342,,2018-08-15 22:26:18,True,,1029856837728907264,,"<a href=""http://twitter.com/download/iphone"" rel=""nofollow"">Twitter for iPhone</a>",JustinTrudeau,52,False,False,,,0.0,0.0,0.0,1.0
826," A year ago, our  deployed the first-ever gender advisor to #OpREASSURANCE. The improvements made as a resu",False,0,,2018-08-15 19:27:36,False,,1029811864593682432,,"<a href=""http://twitter.com"" rel=""nofollow"">Twitter Web Client</a>",JustinTrudeau,77,True,False,,,0.3182,0.126,0.0,0.874
827," Il y a un an, nos  ont déployé le premier conseiller en genre pour #OpRÉASSURANCE. Les améliorations résulta",False,0,,2018-08-15 19:27:33,False,,1029811851385872387,,"<a href=""http://twitter.com"" rel=""nofollow"">Twitter Web Client</a>",JustinTrudeau,19,True,False,,,0.0,0.0,0.0,1.0
828," Our government is making smart investments to help Canadians get the skills, training, and opportunities they need to s",False,0,,2018-08-15 18:28:39,False,,1029797030384816128,,"<a href=""http://twitter.com"" rel=""nofollow"">Twitter Web Client</a>",JustinTrudeau,44,True,False,,,0.7906,0.333,0.0,0.667
829, Notre gouvernement fait des investissements judicieux pour aider les Canadiennes et les Canadiens a acquérir les compét,False,0,,2018-08-15 18:28:35,False,,1029797015528660992,,"<a href=""http://twitter.com"" rel=""nofollow"">Twitter Web Client</a>",JustinTrudeau,17,True,False,,,0.0,0.0,0.0,1.0
830,"A few years ago, I delivered this speech to  on diversity in Canada, and how it makes us the freest people ",False,5351,,2018-08-15 16:39:14,True,,1029769493604651008,,"<a href=""http://twitter.com"" rel=""nofollow"">Twitter Web Client</a>",JustinTrudeau,1351,False,False,,,0.3818,0.115,0.0,0.885
831,"Il y a quelques années, jai prononcé un discours a  au sujet de la diversité au Canada et de la façon dont ",False,402,,2018-08-15 16:35:41,True,,1029768602080169985,,"<a href=""http://twitter.com"" rel=""nofollow"">Twitter Web Client</a>",JustinTrudeau,82,False,False,,,0.0,0.0,0.0,1.0
832, News from #BritishColumbia: We just made our biggest #OceansProtectionPlan investment yet!  We are #CCGProud to introduc,False,0,,2018-08-15 16:08:20,False,,1029761719130828801,,"<a href=""http://twitter.com"" rel=""nofollow"">Twitter Web Client</a>",JustinTrudeau,92,True,False,,,0.0,0.0,0.0,1.0
833, Nouvelles de la #ColombieBritannique: Nous venons de réaliser notre plus gros investissement du #PlanDeProtectionDesOc,False,0,,2018-08-15 16:08:16,False,,1029761701607026688,,"<a href=""http://twitter.com"" rel=""nofollow"">Twitter Web Client</a>",JustinTrudeau,22,True,False,,,0.0,0.0,0.0,1.0
834,"Canada &amp; India share much in common, and today we join the people of India &amp; members of the Indo-Canadian community ",False,1911,,2018-08-15 15:02:16,True,,1029745092209373189,,"<a href=""http://twitter.com"" rel=""nofollow"">Twitter Web Client</a>",JustinTrudeau,423,False,False,,,0.5267,0.188,0.0,0.812
835,"Le Canada et lInde ont beaucoup en commun et aujourdhui, nous nous joignons a la population de lInde et aux memb ",False,255,,2018-08-15 15:01:35,True,,1029744920695857153,,"<a href=""http://twitter.com"" rel=""nofollow"">Twitter Web Client</a>",JustinTrudeau,60,False,False,,,0.0,0.0,0.0,1.0
836," It's just a field now, but soon this site will be home to 's Intergenerational Complex. This community hub w",False,0,,2018-08-15 14:53:10,False,,1029742801037275142,,"<a href=""http://twitter.com"" rel=""nofollow"">Twitter Web Client</a>",JustinTrudeau,23,True,False,,,0.0,0.0,0.0,1.0
837," Juste un champs pour l'instant, mais bientôt il y aura le complexe intergénérationnel de . Ce centre gardera",False,0,,2018-08-15 14:53:03,False,,1029742775141580807,,"<a href=""http://twitter.com"" rel=""nofollow"">Twitter Web Client</a>",JustinTrudeau,17,True,False,,,0.4215,0.141,0.0,0.859
838,"Today, Koreans around the world celebrate the 73rd National Liberation Day of Korea. Sending our best wishes to eve ",False,871,,2018-08-15 14:29:36,True,,1029736871629340675,,"<a href=""http://twitter.com"" rel=""nofollow"">Twitter Web Client</a>",JustinTrudeau,204,False,False,,,0.8591,0.373,0.0,0.627
839,"Aujourdhui, les Coréens a travers le monde célebrent le 73e Jour national de la libération de la Corée. Nos meille ",False,173,,2018-08-15 14:29:11,True,,1029736768713748482,,"<a href=""http://twitter.com"" rel=""nofollow"">Twitter Web Client</a>",JustinTrudeau,31,False,False,,,0.0,0.0,0.0,1.0
840," Happy National Acadian Day! 

August 15 is one of my favourite days of the year - time get loud and celebrate our pride in",False,0,,2018-08-15 14:17:59,False,,1029733950376341504,,"<a href=""http://twitter.com"" rel=""nofollow"">Twitter Web Client</a>",JustinTrudeau,69,True,False,,,0.8777,0.325,0.0,0.675
841," Bonne Fete nationale des Acadiens! 

Jadore célébrer le 15 aout et je vous invite a souligner vous aussi la culture et l",False,0,,2018-08-15 14:17:54,False,,1029733929115365376,,"<a href=""http://twitter.com"" rel=""nofollow"">Twitter Web Client</a>",JustinTrudeau,74,True,False,,,0.2244,0.083,0.0,0.917
842,Acadians hold a special place in our country's history and in our Canadian identity - and today we celebrate their ,False,1697,,2018-08-15 12:43:10,True,,1029710085386371074,,"<a href=""http://twitter.com/download/iphone"" rel=""nofollow"">Twitter for iPhone</a>",JustinTrudeau,401,False,False,,,0.7506,0.262,0.0,0.738
843,"Les Acadiens occupent une place distincte dans l'histoire de notre pays et dans notre identité canadienne et, aujou ",False,417,,2018-08-15 12:42:53,True,,1029710014179680257,,"<a href=""http://twitter.com/download/iphone"" rel=""nofollow"">Twitter for iPhone</a>",JustinTrudeau,126,False,False,,,0.0,0.0,0.0,1.0
844, Our gov't is committed to growing the economy in Atlantic Canada. Great to be in Fredericton this afternoon on behalf of Mi,False,0,,2018-08-14 21:39:34,False,,1029482689806651392,,"<a href=""http://twitter.com"" rel=""nofollow"">Twitter Web Client</a>",JustinTrudeau,63,True,False,,,0.7845,0.294,0.0,0.706
845, Notre gouvernement s'est engagé a faire croître l'économie du Canada atlantique. Un plaisir d'etre a Fredericton au nom de,False,0,,2018-08-14 21:39:28,False,,1029482664338907138,,"<a href=""http://twitter.com"" rel=""nofollow"">Twitter Web Client</a>",JustinTrudeau,20,True,False,,,0.0,0.0,0.0,1.0
846, Absolutely wonderful. Congratulations    ! Investing in the leadership of Af,False,0,,2018-08-14 21:39:09,False,,1029482584361852929,,"<a href=""http://twitter.com"" rel=""nofollow"">Twitter Web Client</a>",JustinTrudeau,74,True,False,,,0.8578,0.514,0.0,0.486
847," We CAN beat cancer  and our government is committed to helping make it happen. 

Thanks to Dr. Marc Therrien for inviting",False,0,,2018-08-14 21:38:31,False,,1029482426370797569,,"<a href=""http://twitter.com"" rel=""nofollow"">Twitter Web Client</a>",JustinTrudeau,37,True,False,,,0.4767,0.307,0.142,0.55
848," Nous POUVONS battre le cancer, et notre gouv. a un rôle a jouer. Merci au Dr. Marc Therrien de avoir minvitée a visiter s",False,0,,2018-08-14 21:38:29,False,,1029482415113289729,,"<a href=""http://twitter.com"" rel=""nofollow"">Twitter Web Client</a>",JustinTrudeau,20,True,False,,,-0.6597,0.0,0.161,0.839
849,"Next week, the Cabinet is heading to Nanaimo, BC for meetings focused on our plan to keep growing the economy and c ",False,1336,,2018-08-14 17:17:07,True,,1029416639316545545,,"<a href=""http://twitter.com"" rel=""nofollow"">Twitter Web Client</a>",JustinTrudeau,289,False,False,,,0.5106,0.177,0.0,0.823
850,"La semaine prochaine, le Cabinet se rendra a Nanaimo, en C.-B., pour tenir des rencontres axées sur notre plan pour ",False,225,,2018-08-14 17:16:11,True,,1029416404846616579,,"<a href=""http://twitter.com"" rel=""nofollow"">Twitter Web Client</a>",JustinTrudeau,45,False,False,,,0.0,0.0,0.0,1.0
851,The pictures from Genoa are heartbreaking. Canada extends its deepest condolences to the friends and loved ones of ,False,6870,,2018-08-14 15:53:09,True,,1029395510879309824,,"<a href=""http://twitter.com"" rel=""nofollow"">Twitter Web Client</a>",JustinTrudeau,1418,False,False,,,0.6705,0.333,0.118,0.549
852,Les photos en provenance de Genes sont dévastatrices. Le Canada offre ses plus sinceres condoléances aux amis et au ,False,596,,2018-08-14 15:52:47,True,,1029395417681866753,,"<a href=""http://twitter.com"" rel=""nofollow"">Twitter Web Client</a>",JustinTrudeau,108,False,False,,,0.0,0.0,0.0,1.0
853, Since we formed government the Canadian economy has created over 60% more full-time jobs than the Conservatives did over th,False,0,,2018-08-14 14:48:54,False,,1029379341627674625,,"<a href=""http://twitter.com"" rel=""nofollow"">Twitter Web Client</a>",JustinTrudeau,287,True,False,,,0.25,0.095,0.0,0.905
854," Depuis que nous formons le gouvernement, léconomie canadienne a créé plus de 60% d'emplois a temps-plein de plus que les",False,0,,2018-08-14 14:47:19,False,,1029378943223312384,,"<a href=""http://twitter.com"" rel=""nofollow"">Twitter Web Client</a>",JustinTrudeau,20,True,False,,,0.0,0.0,0.0,1.0
855,"Today, we join the people of Pakistan and members of the Pakistani community around the world in celebrating Pakist ",False,6864,,2018-08-14 14:37:13,True,,1029376400816570369,,"<a href=""http://twitter.com"" rel=""nofollow"">Twitter Web Client</a>",JustinTrudeau,1909,False,False,,,0.7096,0.258,0.0,0.742
856,"Aujourdhui, nous nous joignons a la population du Pakistan et aux membres de la communauté pakistanaise du monde p ",False,616,,2018-08-14 14:36:30,True,,1029376218699890689,,"<a href=""http://twitter.com"" rel=""nofollow"">Twitter Web Client</a>",JustinTrudeau,133,False,False,,,0.0,0.0,0.0,1.0
857,"Were focused on giving you the support you need to enjoy retirement. Thats why weve lowered OAS back to 65, enha ",False,3306,,2018-08-14 01:23:55,True,,1029176762368843781,,"<a href=""https://studio.twitter.com"" rel=""nofollow"">Media Studio</a>",JustinTrudeau,609,False,False,,,0.8555,0.384,0.053,0.563
858,"Nous voulons vous aider a profiter de votre retraite : nous avons ramené a 65 ans lâge dadmissibilité a la SV, bo ",False,446,,2018-08-14 01:23:14,True,,1029176588997296128,,"<a href=""https://studio.twitter.com"" rel=""nofollow"">Media Studio</a>",JustinTrudeau,70,False,False,,,0.1779,0.075,0.0,0.925
859, All Canadians deserve to be able to retire with dignity. Investments made by the Government of Canada mean seniors can now re,False,0,,2018-08-14 01:04:56,False,,1029171982951165952,,"<a href=""http://twitter.com/download/iphone"" rel=""nofollow"">Twitter for iPhone</a>",JustinTrudeau,60,True,False,,,0.4019,0.114,0.0,0.886
860, Tous les Canadiens méritent davoir une retraite dans la dignité. Les investissements du gouvernement canadien font en sorte,False,0,,2018-08-14 01:04:53,False,,1029171969579778050,,"<a href=""http://twitter.com/download/iphone"" rel=""nofollow"">Twitter for iPhone</a>",JustinTrudeau,15,True,False,,,0.0,0.0,0.0,1.0
861, Thank you to the 1000+ who came out today to welcome PM  to Charlottetown. His 5th trip to PEI in the last,False,0,,2018-08-13 23:53:28,False,,1029153997368840193,,"<a href=""http://twitter.com/download/iphone"" rel=""nofollow"">Twitter for iPhone</a>",JustinTrudeau,113,True,False,,,0.6705,0.216,0.0,0.784
862,"Celebrating Old Home Week in PEI today  a great time on the Island with , , , ",False,917,,2018-08-13 22:27:56,True,,1029132474234888194,,"<a href=""http://twitter.com/download/iphone"" rel=""nofollow"">Twitter for iPhone</a>",JustinTrudeau,178,False,False,,,0.8316,0.328,0.0,0.672
863,Les célébrations de la foire Old Home Week ont eu lieu aujourdhui a lÎ.-P.-É. Jai passé du bon temps sur lÎle a ,False,274,,2018-08-13 22:27:33,True,,1029132377573011456,,"<a href=""http://twitter.com/download/iphone"" rel=""nofollow"">Twitter for iPhone</a>",JustinTrudeau,41,False,False,,,0.0,0.0,0.0,1.0
864, We have accepted an official request for assistance from the Province of BC to help in the fight against the wildfires. T,False,0,,2018-08-13 19:29:16,False,,1029087510524305408,,"<a href=""http://twitter.com"" rel=""nofollow"">Twitter Web Client</a>",JustinTrudeau,301,True,False,,,0.296,0.182,0.098,0.72
865, Nous avons accepté une demande dassistance de la province de la C-B pour aider dans la lutte contre les incendies de for,False,0,,2018-08-13 19:29:13,False,,1029087499073855488,,"<a href=""http://twitter.com"" rel=""nofollow"">Twitter Web Client</a>",JustinTrudeau,19,True,False,,,0.0,0.0,0.0,1.0
866,"Seniors at  &amp; across Canada have worked hard their entire lives, and deserve to feel confident about ",False,1089,,2018-08-13 18:23:29,True,,1029070952905285633,,"<a href=""http://twitter.com"" rel=""nofollow"">Twitter Web Client</a>",JustinTrudeau,246,False,False,,,0.4215,0.163,0.071,0.765
867,Les aînés a  et partout au Canada ont travaillé fort toute leur vie et méritent denvisager leur retr ,False,293,,2018-08-13 18:21:34,True,,1029070473806716928,,"<a href=""http://twitter.com"" rel=""nofollow"">Twitter Web Client</a>",JustinTrudeau,48,False,False,,,0.0,0.0,0.0,1.0
868," Great to join  and  to talk about creating liveable cities at Georges Island, one of the best va",False,0,,2018-08-13 18:10:12,False,,1029067613526261760,,"<a href=""http://twitter.com"" rel=""nofollow"">Twitter Web Client</a>",JustinTrudeau,20,True,False,,,0.9136,0.476,0.0,0.524
869, Bonne discussion a Georges Island avec  et  au sujet du travail visant a bâtir des villes ou il,False,0,,2018-08-13 18:10:08,False,,1029067594068844551,,"<a href=""http://twitter.com"" rel=""nofollow"">Twitter Web Client</a>",JustinTrudeau,14,True,False,,,0.0,0.0,0.0,1.0
870,"Dans les moments difficiles, nous nous rassemblons. Aujourdhui,  et moi nous sommes joints a la comm ",False,845,,2018-08-13 02:08:44,True,,1028825652810719233,,"<a href=""http://twitter.com/download/iphone"" rel=""nofollow"">Twitter for iPhone</a>",JustinTrudeau,113,False,False,,,0.0,0.0,0.0,1.0
871, Met with PM  and Premier  this afternoon in Fredericton. All of Canada stands with Fredericton,False,0,,2018-08-13 02:08:41,False,,1028825637161713664,,"<a href=""http://twitter.com/download/iphone"" rel=""nofollow"">Twitter for iPhone</a>",JustinTrudeau,136,True,False,,,0.0,0.0,0.0,1.0
872, J'ai rencontré le premier ministre  et le premier ministre  cet apres-midi a Fredricton. Tout,False,0,,2018-08-13 02:08:40,False,,1028825634720686080,,"<a href=""http://twitter.com/download/iphone"" rel=""nofollow"">Twitter for iPhone</a>",JustinTrudeau,26,True,False,,,-0.128,0.0,0.103,0.897
873," Joined MP colleagues ,  &amp;  in Fredericton for Pride celebrations. It was a d",False,0,,2018-08-13 02:08:31,False,,1028825597533933568,,"<a href=""http://twitter.com/download/iphone"" rel=""nofollow"">Twitter for iPhone</a>",JustinTrudeau,48,True,False,,,0.34,0.156,0.0,0.844
874,"During tough times, we pull together. Today,  and I joined a grieving community to remember the victi ",False,3326,,2018-08-12 23:10:47,True,,1028780868335226880,,"<a href=""http://twitter.com/download/iphone"" rel=""nofollow"">Twitter for iPhone</a>",JustinTrudeau,660,False,False,,,-0.5859,0.0,0.242,0.758
875,"Canadas young people are leaders, change makers, and ambassadors for a brighter, more peaceful world. Lets make s ",False,5190,,2018-08-12 13:18:12,True,,1028631740980625414,,"<a href=""http://twitter.com/download/iphone"" rel=""nofollow"">Twitter for iPhone</a>",JustinTrudeau,1175,False,False,,,0.7264,0.276,0.0,0.724
876,"Les jeunes du Canada sont des leaders, des agents de changement et des ambassadeurs d'un monde meilleur et plus pac ",False,413,,2018-08-12 13:18:06,True,,1028631713382100992,,"<a href=""http://twitter.com/download/iphone"" rel=""nofollow"">Twitter for iPhone</a>",JustinTrudeau,98,False,False,,,0.0,0.0,0.0,1.0
877," August 11, 1918-Battle of Amiens came to an end with Allied forces having advanced some 20 kilometeres #Canadas100D htt",False,0,,2018-08-11 17:57:06,False,,1028339539461455875,,"<a href=""http://twitter.com/download/iphone"" rel=""nofollow"">Twitter for iPhone</a>",JustinTrudeau,157,True,False,,,0.25,0.1,0.0,0.9
878," 11 aout 1918  Fin de la bataille dAmiens, apres une avancée de 20 km des forces alliées. #100joursduCanada ",False,0,,2018-08-11 17:57:02,False,,1028339521476349952,,"<a href=""http://twitter.com/download/iphone"" rel=""nofollow"">Twitter for iPhone</a>",JustinTrudeau,42,True,False,,,0.0,0.0,0.0,1.0
879,Canadians across the country were shocked to wake up to news of the shooting in Fredericton. We mourn with everyone ,False,2891,,2018-08-10 18:00:29,True,,1027978003983286274,,"<a href=""http://twitter.com"" rel=""nofollow"">Twitter Web Client</a>",JustinTrudeau,794,False,False,,,-0.6249,0.0,0.221,0.779
880,Les Canadiens de partout au pays ont été bouleversés d'apprendre quune fusillade était survenue a Fredericton. Nou ,False,377,,2018-08-10 18:00:05,True,,1027977903689093120,,"<a href=""http://twitter.com"" rel=""nofollow"">Twitter Web Client</a>",JustinTrudeau,98,False,False,,,0.0,0.0,0.0,1.0
881,Awful news coming out of Fredericton. My heart goes out to everyone affected by this mornings shooting. Were foll ,False,7019,,2018-08-10 13:12:01,True,,1027905409791799296,,"<a href=""http://twitter.com/download/iphone"" rel=""nofollow"">Twitter for iPhone</a>",JustinTrudeau,1528,False,False,,,0.1531,0.169,0.185,0.645
882,Des nouvelles terribles en provenance de Fredericton. Je suis de tout coeur avec ceux qui sont touchés par la fusil ,False,625,,2018-08-10 13:11:50,True,,1027905361725083648,,"<a href=""http://twitter.com/download/iphone"" rel=""nofollow"">Twitter for iPhone</a>",JustinTrudeau,160,False,False,,,-0.128,0.0,0.073,0.927
883, What a warm welcome from the Italian community of Montreal. Thanks to  for being a great guide! ,False,0,,2018-08-10 02:47:55,False,,1027748348734918656,,"<a href=""http://twitter.com/download/iphone"" rel=""nofollow"">Twitter for iPhone</a>",JustinTrudeau,53,True,False,,,0.9041,0.484,0.0,0.516
884, Quel accueil chaleureux de la communauté italienne de Montréal. Merci  davoir servi de guide! ,False,0,,2018-08-10 02:47:52,False,,1027748334784704512,,"<a href=""http://twitter.com/download/iphone"" rel=""nofollow"">Twitter for iPhone</a>",JustinTrudeau,17,True,False,,,0.0,0.0,0.0,1.0
885,"Italian-Canadians enrich our cities &amp; move us forward in business, innovation, and the arts. Earlier tonight, I sto ",False,1955,,2018-08-10 02:44:46,True,,1027747557471080448,,"<a href=""http://twitter.com/download/iphone"" rel=""nofollow"">Twitter for iPhone</a>",JustinTrudeau,328,False,False,,,0.3818,0.133,0.0,0.867
886,Were #BuildingOurCommunities by investing in infrastructure projects that make your lives better - like the Côte-V ,False,1541,,2018-08-10 02:28:16,True,,1027743401251352582,,"<a href=""http://twitter.com/download/iphone"" rel=""nofollow"">Twitter for iPhone</a>",JustinTrudeau,270,False,False,,,0.6597,0.278,0.0,0.722
887,"Nous bâtissons nos communautés en  investissant dans des projets dinfrastructure qui améliorent nos vies, comme le ",False,348,,2018-08-10 02:27:35,True,,1027743231562469377,,"<a href=""http://twitter.com/download/iphone"" rel=""nofollow"">Twitter for iPhone</a>",JustinTrudeau,50,False,False,,,0.0,0.0,0.0,1.0
888, Thanks for visiting  Prime Minister  and . Were proud that the #RADARSAT Constellation,False,0,,2018-08-09 23:22:59,False,,1027696775971393538,,"<a href=""http://twitter.com/download/iphone"" rel=""nofollow"">Twitter for iPhone</a>",JustinTrudeau,88,True,False,,,0.7184,0.353,0.0,0.647
889,"The satellites being built at  in QC will help us measure the effects of climate change, monitor the ocea ",False,2043,,2018-08-09 23:00:58,True,,1027691233433608192,,"<a href=""http://twitter.com/download/iphone"" rel=""nofollow"">Twitter for iPhone</a>",JustinTrudeau,464,False,False,,,0.4019,0.13,0.0,0.87
890,"Les satellites de  du QC fournissent des données sur les changements climatiques, les océans et les catas ",False,289,,2018-08-09 23:00:38,True,,1027691151523020800,,"<a href=""http://twitter.com/download/iphone"" rel=""nofollow"">Twitter for iPhone</a>",JustinTrudeau,41,False,False,,,0.0,0.0,0.0,1.0
891, I spent a good part of my day visiting construction sites; thanks to all the workers who are building our infrastructure,False,0,,2018-08-09 22:42:45,False,,1027686651907194881,,"<a href=""http://twitter.com/download/iphone"" rel=""nofollow"">Twitter for iPhone</a>",JustinTrudeau,39,True,False,,,0.7003,0.234,0.0,0.766
892, Jai passé une bonne partie de ma journée sur les chantiers; merci aux milliers de travailleurs et travailleuses de la co,False,0,,2018-08-09 22:42:42,False,,1027686637906677761,,"<a href=""http://twitter.com/download/iphone"" rel=""nofollow"">Twitter for iPhone</a>",JustinTrudeau,16,True,False,,,0.0,0.0,0.0,1.0
893,"We need more diversity in leadership roles  in government &amp; business.  is an inspiring leader, who has ",False,1292,,2018-08-09 22:29:07,True,,1027683220983296002,,"<a href=""http://twitter.com/download/iphone"" rel=""nofollow"">Twitter for iPhone</a>",JustinTrudeau,269,False,False,,,0.4215,0.141,0.0,0.859
894,Il faut plus de diversité aux échelons supérieurs des gouvernements et des entreprises.  est une dirigea ,False,234,,2018-08-09 22:28:52,True,,1027683156491685890,,"<a href=""http://twitter.com/download/iphone"" rel=""nofollow"">Twitter for iPhone</a>",JustinTrudeau,41,False,False,,,0.0,0.0,0.0,1.0
895," Today, Im proud to announce that we have helped secure new voluntary commitments from ,  &amp; ",False,0,,2018-08-09 19:03:12,False,,1027631396561580033,,"<a href=""http://twitter.com"" rel=""nofollow"">Twitter Web Client</a>",JustinTrudeau,72,True,False,,,0.7184,0.35,0.0,0.65
896," Aujourdhui, jannonce avec fierté que nous avons de nouveaux engagements volontaires de ,  et ",False,0,,2018-08-09 19:03:03,False,,1027631359517499393,,"<a href=""http://twitter.com"" rel=""nofollow"">Twitter Web Client</a>",JustinTrudeau,26,True,False,,,0.1531,0.11,0.0,0.89
897,"Known as the father of modern education in Quebec, Paul Gérin-Lajoie shaped the province in so many ways. We are ex ",False,1070,,2018-08-09 17:44:04,True,,1027611484090781696,,"<a href=""http://twitter.com"" rel=""nofollow"">Twitter Web Client</a>",JustinTrudeau,147,False,False,,,0.0,0.0,0.0,1.0
