,text,favorited,favoriteCount,replyToSN,created,truncated,replyToSID,id,replyToUID,statusSource,screenName,retweetCount,isRetweet,retweeted,longitude,latitude,Compound,Positive,Negative,Neutral
1633," June 6, 1944. 
Juno Beach.

""Let the hearts of all in Canada today be filled with silent prayer for the success of our ow",False,0,,2018-06-06 12:57:49,False,,1004346625047834625,,"<a href=""http://twitter.com/download/iphone"" rel=""nofollow"">Twitter for iPhone</a>",JustinTrudeau,1479,True,False,,,0.8402,0.267,0.0,0.733
1634," 6 juin 1944.
Juno Beach.

«Que le cour de tous les Canadiens soit aujourd'hui  rempli de priere silencieuse pour le succe",False,0,,2018-06-06 12:57:40,False,,1004346586644799489,,"<a href=""http://twitter.com/download/iphone"" rel=""nofollow"">Twitter for iPhone</a>",JustinTrudeau,122,True,False,,,0.0,0.0,0.0,1.0
1635,"On the 74th anniversary of #DDay, we remember the Canadian troops who fought with great courage and made the ultima ",False,12344,,2018-06-06 12:01:57,True,,1004332564017016832,,"<a href=""http://twitter.com/download/iphone"" rel=""nofollow"">Twitter for iPhone</a>",JustinTrudeau,3588,False,False,,,0.7184,0.274,0.086,0.639
1636,"En ce 74e anniversaire du #JourJ, nous nous souvenons des troupes canadiennes qui ont combattu avec énormément de c ",False,493,,2018-06-06 12:01:42,True,,1004332500871761920,,"<a href=""http://twitter.com/download/iphone"" rel=""nofollow"">Twitter for iPhone</a>",JustinTrudeau,134,False,False,,,0.0,0.0,0.0,1.0
1637,"Were building the TMX pipeline to:
<U+2714><U+FE0F> Create &amp; protect thousands of good, well-paying jobs
<U+2714><U+FE0F> Get our resources to ",False,1768,,2018-06-06 02:05:06,True,,1004182360169025536,,"<a href=""http://twitter.com/download/iphone"" rel=""nofollow"">Twitter for iPhone</a>",JustinTrudeau,297,False,False,,,0.765,0.309,0.0,0.691
1638,"Nous construisons loléoduc TMX pour :
<U+2714><U+FE0F> Créer et protéger des milliers de bons emplois bien rémunérés
<U+2714><U+FE0F> Mettre n ",False,232,,2018-06-06 02:04:39,True,,1004182249376550914,,"<a href=""http://twitter.com/download/iphone"" rel=""nofollow"">Twitter for iPhone</a>",JustinTrudeau,49,False,False,,,0.0,0.0,0.0,1.0
1639,"Were one year away from the  conference  from June 3-6, 2019, world leaders, activists, government o ",False,958,,2018-06-06 01:20:17,True,,1004171084395106304,,"<a href=""http://twitter.com/download/iphone"" rel=""nofollow"">Twitter for iPhone</a>",JustinTrudeau,256,False,False,,,0.0,0.0,0.0,1.0
1640,"La conférence  aura lieu dans un an. Du 3 au 6 juin 2019, dirigeants mondiaux, activistes, fonctionnai ",False,185,,2018-06-06 01:19:48,True,,1004170962336657408,,"<a href=""http://twitter.com/download/iphone"" rel=""nofollow"">Twitter for iPhone</a>",JustinTrudeau,46,False,False,,,0.0,0.0,0.0,1.0
1641,"The TMX pipeline project will create thousands of good jobs, and were committed to working in collaboration with I ",False,678,,2018-06-06 01:00:28,True,,1004166094532304896,,"<a href=""http://twitter.com/download/iphone"" rel=""nofollow"">Twitter for iPhone</a>",JustinTrudeau,133,False,False,,,0.7269,0.307,0.0,0.693
1642,"Le projet doléoduc TMX permettra de créer des milliers de bons emplois, et nous avons bien lintention de travaill ",False,197,,2018-06-06 01:00:09,True,,1004166016874762242,,"<a href=""http://twitter.com/download/iphone"" rel=""nofollow"">Twitter for iPhone</a>",JustinTrudeau,41,False,False,,,0.0,0.0,0.0,1.0
1643," As co-chair of the #G7 Gender Equality Advisory Council, our message going into this years summit is clear: its time to",False,0,,2018-06-05 19:55:41,False,,1004089394616299526,,"<a href=""http://twitter.com"" rel=""nofollow"">Twitter Web Client</a>",JustinTrudeau,906,True,False,,,0.3818,0.115,0.0,0.885
1644," Were thrilled to announce that  Ultrafiltered Milk is coming to Canada this fall. In addition, were building",False,0,,2018-06-05 15:54:11,False,,1004028620434804738,,"<a href=""http://twitter.com"" rel=""nofollow"">Twitter Web Client</a>",JustinTrudeau,120,True,False,,,0.4404,0.153,0.0,0.847
1645," Check out all the garbage that we found today along the #Ottawa River. If you see plastic along our shores, please help cl",False,0,,2018-06-05 13:52:48,False,,1003998071339081730,,"<a href=""http://twitter.com"" rel=""nofollow"">Twitter Web Client</a>",JustinTrudeau,255,True,False,,,0.6124,0.192,0.0,0.808
1646, Voyez toutes les ordures que nous avons trouvées aujourd'hui le long de la riviere #Outaouais. Si vous voyez du plastique,False,0,,2018-06-05 13:52:43,False,,1003998049813893121,,"<a href=""http://twitter.com"" rel=""nofollow"">Twitter Web Client</a>",JustinTrudeau,36,True,False,,,0.0,0.0,0.0,1.0
1647,"Plastic pollution is a global challenge that doesnt respect borders  it litters our streets, accumulates in our l ",False,3025,,2018-06-05 13:34:53,True,,1003993565297545216,,"<a href=""http://twitter.com/download/iphone"" rel=""nofollow"">Twitter for iPhone</a>",JustinTrudeau,873,False,False,,,0.7506,0.316,0.0,0.684
1648,"La pollution par le plastique, un défi mondial qui ne connaît pas de frontieres. Le plastique pollue nos rues, remp ",False,274,,2018-06-05 13:34:29,True,,1003993464336470016,,"<a href=""http://twitter.com/download/iphone"" rel=""nofollow"">Twitter for iPhone</a>",JustinTrudeau,79,False,False,,,0.0,0.0,0.0,1.0
1649,Patricia Fuller will lead Canadas efforts &amp; work with our global partners to tackle climate change and promote cle ,False,750,,2018-06-05 12:52:52,True,,1003982990530228230,,"<a href=""http://twitter.com/download/iphone"" rel=""nofollow"">Twitter for iPhone</a>",JustinTrudeau,181,False,False,,,0.3818,0.126,0.0,0.874
1650,Patricia Fuller dirigera les efforts que le Canada fera et travaillera avec nos partenaires mondiaux afin de satta ,False,180,,2018-06-05 12:51:54,True,,1003982748007194627,,"<a href=""http://twitter.com/download/iphone"" rel=""nofollow"">Twitter for iPhone</a>",JustinTrudeau,37,False,False,,,0.0,0.0,0.0,1.0
1651,"It was great to meet you all today and Clarky, of course. Congratulations again! #ClarksonCup2018 ",False,869,,2018-06-05 02:08:54,False,,1003820931360288768,,"<a href=""http://twitter.com/download/iphone"" rel=""nofollow"">Twitter for iPhone</a>",JustinTrudeau,130,False,False,,,0.8516,0.389,0.0,0.611
1652,"Ce fut un vrai plaisir de vous rencontrer aujourdhui... et Clarky aussi, bien entendu. Encore félicitations! ",False,270,,2018-06-05 02:08:42,True,,1003820878801653760,,"<a href=""http://twitter.com/download/iphone"" rel=""nofollow"">Twitter for iPhone</a>",JustinTrudeau,31,False,False,,,0.0,0.0,0.0,1.0
1653," Today I rose in the House of Commons to commemorate #PrideMonth!

<U+0001F3F3><U+FE0F><U+200D><U+0001F308><U+0001F3F3><U+FE0F><U+200D><U+0001F308><U+0001F3F3><U+FE0F><U+200D><U+0001F308>

Aujourdhui, je me suis levé a la Chamb",False,0,,2018-06-05 01:46:06,False,,1003815192206151681,,"<a href=""http://twitter.com/download/iphone"" rel=""nofollow"">Twitter for iPhone</a>",JustinTrudeau,147,True,False,,,0.0,0.0,0.0,1.0
1654," 'During the First World War Longboat served as a dispatch runner, running messages between military posts.

He was twice",False,0,,2018-06-05 01:42:36,False,,1003814311893127169,,"<a href=""http://twitter.com/download/iphone"" rel=""nofollow"">Twitter for iPhone</a>",JustinTrudeau,198,True,False,,,-0.5994,0.0,0.178,0.822
1655,"Awful news of a bus crash in Prescott, ON this afternoon  were monitoring the situation and offer our sympathies ",False,1203,,2018-06-04 23:37:39,True,,1003782867321802752,,"<a href=""http://twitter.com/download/iphone"" rel=""nofollow"">Twitter for iPhone</a>",JustinTrudeau,231,False,False,,,-0.6908,0.0,0.241,0.759
1656,"Terrible nouvelle d'un accident d'autobus a Prescott, en Ontario, cet apres-midi. Nous suivons la situation et offr ",False,217,,2018-06-04 23:37:26,True,,1003782813097889792,,"<a href=""http://twitter.com/download/iphone"" rel=""nofollow"">Twitter for iPhone</a>",JustinTrudeau,57,False,False,,,-0.7351,0.0,0.292,0.708
1657,"Last week, we took action against the unacceptable American tariffs on our steel and aluminum industry. Today in Ot ",False,2837,,2018-06-04 22:40:44,True,,1003768542049787906,,"<a href=""http://twitter.com"" rel=""nofollow"">Twitter Web Client</a>",JustinTrudeau,569,False,False,,,-0.4588,0.0,0.143,0.857
1658,"La semaine derniere, nous avons pris des mesures contre les droits inacceptables imposés par les États-Unis sur not ",False,257,,2018-06-04 22:39:49,True,,1003768311761571841,,"<a href=""http://twitter.com"" rel=""nofollow"">Twitter Web Client</a>",JustinTrudeau,55,False,False,,,0.0,0.0,0.0,1.0
1659, Calling the world +  leaders! Just out: the potent and bold recommendations from the #g7 #GenderEquality Advisory Cou,False,0,,2018-06-04 22:22:18,False,,1003763902960848897,,"<a href=""http://twitter.com"" rel=""nofollow"">Twitter Web Client</a>",JustinTrudeau,148,True,False,,,0.4389,0.145,0.0,0.855
1660, Honoured to be part  Gender Equality Advisory Council made up of feminist trouble makers. Today we release our #MakeGen,False,0,,2018-06-04 22:04:09,False,,1003759337704165376,,"<a href=""http://twitter.com"" rel=""nofollow"">Twitter Web Client</a>",JustinTrudeau,138,True,False,,,0.128,0.14,0.118,0.742
1661,Gender equality is a fundamental human right &amp; key to economic growth. Thanks to the #G7 Gender Equality Advisory C ,False,2040,,2018-06-04 21:52:54,True,,1003756507534675969,,"<a href=""http://twitter.com"" rel=""nofollow"">Twitter Web Client</a>",JustinTrudeau,556,False,False,,,0.6705,0.234,0.0,0.766
1662,L'égalité des sexes est un droit fondamental essentiel a la croissance économique. Merci au Conseil consultatif sur ,False,269,,2018-06-04 21:51:47,True,,1003756225874612224,,"<a href=""http://twitter.com"" rel=""nofollow"">Twitter Web Client</a>",JustinTrudeau,76,False,False,,,0.0,0.0,0.0,1.0
1663,On my   the 5 priorities well be working on with our partners and allies as we focus on creating growth ,False,872,,2018-06-04 20:57:02,True,,1003742448064061441,,"<a href=""http://twitter.com"" rel=""nofollow"">Twitter Web Client</a>",JustinTrudeau,200,False,False,,,0.5859,0.202,0.0,0.798
1664,Sur ma page   les cinq priorités auxquelles je travaillerai avec mes partenaires et alliés au Sommet des ,False,172,,2018-06-04 20:56:25,True,,1003742289771073536,,"<a href=""http://twitter.com"" rel=""nofollow"">Twitter Web Client</a>",JustinTrudeau,38,False,False,,,0.0,0.0,0.0,1.0
1665," Appalled by the abhorrent statement from Supreme Leader Khamenei. Canada strongly condemns this incitement to violence, and",False,0,,2018-06-04 20:07:16,False,,1003729920160301056,,"<a href=""http://twitter.com/download/iphone"" rel=""nofollow"">Twitter for iPhone</a>",JustinTrudeau,378,True,False,,,-0.8689,0.183,0.465,0.353
1666, Consternée par la déclaration horrible du Supreme leader Khamenei. Le Canada condamne fortement cet appel a la violence + c,False,0,,2018-06-04 20:07:14,False,,1003729912484827137,,"<a href=""http://twitter.com/download/iphone"" rel=""nofollow"">Twitter for iPhone</a>",JustinTrudeau,50,True,False,,,-0.6124,0.128,0.27,0.603
1667,"Another good day for commuters. Across this great country, our investments in infrastructure are ",False,760,,2018-06-04 16:44:59,True,,1003679016883245056,,"<a href=""http://twitter.com"" rel=""nofollow"">Twitter Web Client</a>",JustinTrudeau,135,False,False,,,0.8305,0.393,0.0,0.607
1668,"Une autre belle journée pour les usagers de la route. Dun bout a lautre de notre formidable pays, nos investissem ",False,196,,2018-06-04 16:44:33,True,,1003678908066287618,,"<a href=""http://twitter.com"" rel=""nofollow"">Twitter Web Client</a>",JustinTrudeau,48,False,False,,,0.0,0.0,0.0,1.0
1669," Hier, a Edmonton, jai rencontré des membres de la Force opérationnelle aérienne Mali, réunis pour la premiere fois. P",False,0,,2018-06-04 01:32:21,False,,1003449344153014272,,"<a href=""http://twitter.com/download/iphone"" rel=""nofollow"">Twitter for iPhone</a>",JustinTrudeau,36,True,False,,,0.0,0.0,0.0,1.0
1670," Yesterday in Edmonton I met with the members of Task Force Mali, gathered together for the first time. For #CanadianAr",False,0,,2018-06-03 19:08:14,False,,1003352679538667520,,"<a href=""http://twitter.com/download/iphone"" rel=""nofollow"">Twitter for iPhone</a>",JustinTrudeau,161,True,False,,,0.0,0.0,0.0,1.0
1671," Today, on #CAF Day, we thank our women and men in uniform who serve our nation selflessly, defending Canadas interests",False,0,,2018-06-03 17:29:18,False,,1003327781495853058,,"<a href=""http://twitter.com/download/iphone"" rel=""nofollow"">Twitter for iPhone</a>",JustinTrudeau,564,True,False,,,0.5423,0.2,0.0,0.8
1672," Aujourdhui, a loccasion de la Journée des #FAC, nous remercions les femmes et les hommes en uniforme qui servent notre",False,0,,2018-06-03 17:29:12,False,,1003327755260518406,,"<a href=""http://twitter.com/download/iphone"" rel=""nofollow"">Twitter for iPhone</a>",JustinTrudeau,59,True,False,,,0.0,0.0,0.0,1.0
1673," #Today, we celebrate  Day. Please join us in recognizing #CAF personnel serving across Canada, and abroad, for",False,0,,2018-06-03 16:01:47,False,,1003305755162955777,,"<a href=""http://twitter.com/download/iphone"" rel=""nofollow"">Twitter for iPhone</a>",JustinTrudeau,299,True,False,,,0.802,0.369,0.0,0.631
1674," #Aujourdhui, nous célébrons la Journée des . Joignez-vous a nous afin de saluer les militaires des #FAC, q",False,0,,2018-06-03 16:01:37,False,,1003305716118163456,,"<a href=""http://twitter.com/download/iphone"" rel=""nofollow"">Twitter for iPhone</a>",JustinTrudeau,37,True,False,,,0.0,0.0,0.0,1.0
1675,"Its  Day! This week, I was honoured to spend some time with the personnel at CFB Greenwood in Nova ",False,4400,,2018-06-03 12:06:21,True,,1003246506835496960,,"<a href=""https://studio.twitter.com"" rel=""nofollow"">Media Studio</a>",JustinTrudeau,822,False,False,,,0.5411,0.162,0.0,0.838
1676,"Cest la Journée des ! Cette semaine, jai eu lhonneur de remercier les membres du personnel de la BF ",False,437,,2018-06-03 12:04:51,True,,1003246130572886016,,"<a href=""https://studio.twitter.com"" rel=""nofollow"">Media Studio</a>",JustinTrudeau,82,False,False,,,0.0,0.0,0.0,1.0
1677," Our #G7 Development Ministerial Meeting has just ended. Together, we act on behalf of adolescent girls, and to truly adv",False,0,,2018-06-02 22:23:16,False,,1003039371925303297,,"<a href=""http://twitter.com/download/iphone"" rel=""nofollow"">Twitter for iPhone</a>",JustinTrudeau,98,True,False,,,0.4404,0.132,0.0,0.868
1678," Notre ministérielle du #G7 Développement vient de prendre fin. Ensemble, nous agissons en faveur des adolescentes, et po",False,0,,2018-06-02 22:23:12,False,,1003039357085863941,,"<a href=""http://twitter.com/download/iphone"" rel=""nofollow"">Twitter for iPhone</a>",JustinTrudeau,39,True,False,,,-0.5574,0.0,0.175,0.825
1679," Between Budgets 2016 &amp; 2018, almost $2 billion has been committed to improve water and wastewater infrastructure on reser",False,0,,2018-06-02 21:51:40,False,,1003031420925865985,,"<a href=""http://twitter.com/download/iphone"" rel=""nofollow"">Twitter for iPhone</a>",JustinTrudeau,113,True,False,,,0.6124,0.227,0.0,0.773
1680," Entre les Budgets de 2016 et 2018, pres de 2 milliards de dollars ont été engagés pour améliorer l'infrastructure de l'ea",False,0,,2018-06-02 21:51:36,False,,1003031401351000064,,"<a href=""http://twitter.com/download/iphone"" rel=""nofollow"">Twitter for iPhone</a>",JustinTrudeau,26,True,False,,,0.0,0.0,0.0,1.0
1681," National #AccessAbility Week was a whirlwind - and it was an incredible experience, from one part of the country to ano",False,0,,2018-06-02 21:19:00,False,,1003023198353526784,,"<a href=""http://twitter.com/download/iphone"" rel=""nofollow"">Twitter for iPhone</a>",JustinTrudeau,46,True,False,,,0.0,0.0,0.0,1.0
1682," La Semaine nationale de l'#accessibilité a été un vrai tourbillon, et quelle expérience de visiter plusieurs endroits a",False,0,,2018-06-02 21:18:57,False,,1003023185661620224,,"<a href=""http://twitter.com/download/iphone"" rel=""nofollow"">Twitter for iPhone</a>",JustinTrudeau,13,True,False,,,0.0,0.0,0.0,1.0
1683,Great memories of this historic flag raising ceremony on Parliament Hill  a symbol of our commitment to build a co ,False,11150,,2018-06-01 23:29:25,True,,1002693632783273984,,"<a href=""http://twitter.com"" rel=""nofollow"">Twitter Web Client</a>",JustinTrudeau,2271,False,False,,,0.7717,0.261,0.0,0.739
1684,Excellents souvenirs de cette historique cérémonie de lever du drapeau sur la Colline du Parlement  un symbole de ,False,506,,2018-06-01 23:29:07,True,,1002693556040097792,,"<a href=""http://twitter.com"" rel=""nofollow"">Twitter Web Client</a>",JustinTrudeau,87,False,False,,,0.0,0.0,0.0,1.0
1685,"Dr. Mohamed-Iqbal Ravalias knowledge &amp; experience have earned him respect in the medical field, and Im confident ",False,969,,2018-06-01 22:52:39,True,,1002684379553034241,,"<a href=""http://twitter.com"" rel=""nofollow"">Twitter Web Client</a>",JustinTrudeau,194,False,False,,,0.743,0.296,0.0,0.704
1686,Lexpertise du Dr Mohamed-Iqbal Ravalia lui a valu le respect de la communauté médicale. Il sera sans doute un exce ,False,211,,2018-06-01 22:52:06,True,,1002684240834826241,,"<a href=""http://twitter.com"" rel=""nofollow"">Twitter Web Client</a>",JustinTrudeau,34,False,False,,,0.4767,0.14,0.0,0.86
1687,"In Halifax today, Minister  and I met with Mayors at #FCM2018AC to talk about the projects we can work ",False,684,,2018-06-01 22:16:19,True,,1002675233004847104,,"<a href=""http://twitter.com"" rel=""nofollow"">Twitter Web Client</a>",JustinTrudeau,106,False,False,,,0.0,0.0,0.0,1.0
1688,"Aujourdhui, au #FCM2018CA a Halifax, le ministre  et moi avons discuté avec des maires des projets qu ",False,221,,2018-06-01 22:14:58,True,,1002674894230970368,,"<a href=""http://twitter.com"" rel=""nofollow"">Twitter Web Client</a>",JustinTrudeau,46,False,False,,,0.0,0.0,0.0,1.0
1689," HAPPY PRIDE MONTH! <U+0001F3F3><U+FE0F><U+200D><U+0001F308> JOYEUX MOIS DE LA FIERTÉ ! 

#PrideMonth #freetobeme #soistoimeme #LGBTQ2 ",False,0,,2018-06-01 21:04:01,False,,1002657040722997248,,"<a href=""http://twitter.com"" rel=""nofollow"">Twitter Web Client</a>",JustinTrudeau,161,True,False,,,0.8462,0.404,0.0,0.596
1690, Its  today! Milk is full of nutrients and one of Canadas favourite drinks. Thanks to all the hard working da,False,0,,2018-06-01 20:37:15,False,,1002650304976965633,,"<a href=""http://twitter.com"" rel=""nofollow"">Twitter Web Client</a>",JustinTrudeau,65,True,False,,,0.4199,0.141,0.062,0.797
1691, C'est  aujourd'hui! Le lait est plein de nutriments et l'une des boissons préférées du Canada. Merci a tous le,False,0,,2018-06-01 20:37:12,False,,1002650289646731270,,"<a href=""http://twitter.com"" rel=""nofollow"">Twitter Web Client</a>",JustinTrudeau,24,True,False,,,0.0,0.0,0.0,1.0
1692, Today we celebrate #WorldMilkDay and our Canadian dairy farmers! We #RaiseAGlass to you! ,False,0,,2018-06-01 20:36:50,False,,1002650199460929537,,"<a href=""http://twitter.com"" rel=""nofollow"">Twitter Web Client</a>",JustinTrudeau,71,True,False,,,0.6467,0.263,0.0,0.737
1693," Aujourdhui, nous célébrons la #JournéeMondialeduLait, ainsi que le travail de nos producteurs laitiers canadiens! Santé! http",False,0,,2018-06-01 20:36:44,False,,1002650173963751424,,"<a href=""http://twitter.com"" rel=""nofollow"">Twitter Web Client</a>",JustinTrudeau,28,True,False,,,0.0,0.0,0.0,1.0
1694," Le premier ministre du Canada, M. , a répondu aux questions des trois camelots-rédacteurs de LItinéraire. #",False,0,,2018-06-01 17:03:51,False,,1002596601393795073,,"<a href=""http://twitter.com"" rel=""nofollow"">Twitter Web Client</a>",JustinTrudeau,42,True,False,,,0.0,0.0,0.0,1.0
1695,"Argentina <U+0001F1E6><U+0001F1F7> 
Bangladesh <U+0001F1E7><U+0001F1E9> 
Haiti <U+0001F1ED><U+0001F1F9> 
Jamaica <U+0001F1EF><U+0001F1F2> 
Kenya <U+0001F1F0><U+0001F1EA> 
Marshall Islands <U+0001F1F2><U+0001F1ED> 
Norway <U+0001F1F3><U+0001F1F4> 
Rwanda <U+0001F1F7><U+0001F1FC> 
Senegal <U+0001F1F8><U+0001F1F3> ",False,1088,JustinTrudeau,2018-06-01 15:38:48,True,1.0025751966189363e+18,1002575198292529152,14260960.0,"<a href=""http://twitter.com/download/iphone"" rel=""nofollow"">Twitter for iPhone</a>",JustinTrudeau,178,False,False,,,0.0,0.0,0.0,1.0
1696,"Next week, well welcome  leaders to Charlevoix to address some of the worlds most pressing challenges together ",False,1425,,2018-06-01 15:38:48,True,,1002575196618936321,,"<a href=""http://twitter.com/download/iphone"" rel=""nofollow"">Twitter for iPhone</a>",JustinTrudeau,303,False,False,,,0.5542,0.234,0.0,0.766
1697,"Argentine <U+0001F1E6><U+0001F1F7> 
Bangladesh <U+0001F1E7><U+0001F1E9> 
Haiti <U+0001F1ED><U+0001F1F9> 
Jamaique <U+0001F1EF><U+0001F1F2> 
Kenya <U+0001F1F0><U+0001F1EA> 
Îles Marshall <U+0001F1F2><U+0001F1ED> 
Norvege <U+0001F1F3><U+0001F1F4> 
Rwanda <U+0001F1F7><U+0001F1FC> 
Sénégal <U+0001F1F8><U+0001F1F3> ",False,280,JustinTrudeau,2018-06-01 15:37:38,True,1.0025749021620838e+18,1002574903948840963,14260960.0,"<a href=""http://twitter.com/download/iphone"" rel=""nofollow"">Twitter for iPhone</a>",JustinTrudeau,62,False,False,,,0.0,0.0,0.0,1.0
1698,"La semaine prochaine, nous accueillerons les dirigeants du  a Charlevoix pour parler denjeux mondiaux urgents ",False,235,,2018-06-01 15:37:38,True,,1002574902162083845,,"<a href=""http://twitter.com/download/iphone"" rel=""nofollow"">Twitter for iPhone</a>",JustinTrudeau,54,False,False,,,0.0,0.0,0.0,1.0
1699, And it's official! So excited to have  announce our 20 #smartcitiesCanada finalists live from #FCM2018AC! C,False,0,,2018-06-01 14:32:02,False,,1002558393016573952,,"<a href=""http://twitter.com"" rel=""nofollow"">Twitter Web Client</a>",JustinTrudeau,47,True,False,,,0.5719,0.198,0.0,0.802
1700, Et c'est officiel! Nous sommes ravis que  ait annoncé les 20 finalistes du défi #villesintelligentesCanada,False,0,,2018-06-01 14:31:58,False,,1002558376100990977,,"<a href=""http://twitter.com"" rel=""nofollow"">Twitter Web Client</a>",JustinTrudeau,19,True,False,,,0.0,0.0,0.0,1.0
1701, Ouverture du congres annuel de la  a Halifax ce matin. : « Were not a government that believe,False,0,,2018-06-01 13:44:05,False,,1002546326721187840,,"<a href=""http://twitter.com"" rel=""nofollow"">Twitter Web Client</a>",JustinTrudeau,36,True,False,,,0.0,0.0,0.0,1.0
1702, Communities and cities are essential partners in shaping Canada. PM  #FCM2018AC #CDNmuni ,False,0,,2018-06-01 13:39:38,False,,1002545208632934400,,"<a href=""http://twitter.com"" rel=""nofollow"">Twitter Web Client</a>",JustinTrudeau,53,True,False,,,0.0,0.0,0.0,1.0
1703, Le premier ministre  sadresse aux délégués de la FCM : « Ensemble nous allons créer un Canada plus fort. Cont,False,0,,2018-06-01 13:39:34,False,,1002545192342380544,,"<a href=""http://twitter.com"" rel=""nofollow"">Twitter Web Client</a>",JustinTrudeau,29,True,False,,,0.0,0.0,0.0,1.0
1704, Watch live: Prime Minister Justin Trudeau speaks at the Federation of Canadian Municipalities Annual Conference. ,False,0,,2018-06-01 12:12:32,False,,1002523289258848256,,"<a href=""http://twitter.com/download/iphone"" rel=""nofollow"">Twitter for iPhone</a>",JustinTrudeau,51,True,False,,,0.0,0.0,0.0,1.0
1705, En direct: le premier ministre Justin Trudeau prend la parole lors du Congres annuel de la Fédération canadienne des munici,False,0,,2018-06-01 12:12:27,False,,1002523265187762176,,"<a href=""http://twitter.com/download/iphone"" rel=""nofollow"">Twitter for iPhone</a>",JustinTrudeau,19,True,False,,,0.0,0.0,0.0,1.0
1706, Pleased to announce that the Prime Minister  will address #FCM2018AC delegates and municipal leaders tomorrow,False,0,,2018-06-01 11:48:44,False,,1002517298567995392,,"<a href=""http://twitter.com/download/iphone"" rel=""nofollow"">Twitter for iPhone</a>",JustinTrudeau,54,True,False,,,0.4404,0.172,0.0,0.828
1707, Nous avons le plaisir d'annoncer que le Premier ministre  s'adressera a nos élus municipaux au Congres #FCM201,False,0,,2018-06-01 11:48:33,False,,1002517251910557696,,"<a href=""http://twitter.com/download/iphone"" rel=""nofollow"">Twitter for iPhone</a>",JustinTrudeau,28,True,False,,,0.0,0.0,0.0,1.0
1708,"Americans remain our partners, friends, and allies. This is not about the American people. We have to believe that ",False,38425,JustinTrudeau,2018-05-31 19:11:21,True,1.0022483688344003e+18,1002266297865048064,14260960.0,"<a href=""http://twitter.com"" rel=""nofollow"">Twitter Web Client</a>",JustinTrudeau,11807,False,False,,,0.4767,0.147,0.0,0.853
1709,"Nous devons croire quéventuellement le bon sens triomphera. Mais malheureusement, les actions prises par le gouver ",False,600,JustinTrudeau,2018-05-31 19:10:49,True,1.0022661626952335e+18,1002266163613765632,14260960.0,"<a href=""http://twitter.com"" rel=""nofollow"">Twitter Web Client</a>",JustinTrudeau,156,False,False,,,0.0,0.0,0.0,1.0
1710,"Les Américains demeurent nos partenaires, nos amis et nos alliés. Le peuple américain ne fait pas lobjet de lannonce daujourdhui.",False,518,JustinTrudeau,2018-05-31 19:10:49,False,1.0022481031924204e+18,1002266162695233537,14260960.0,"<a href=""http://twitter.com"" rel=""nofollow"">Twitter Web Client</a>",JustinTrudeau,120,False,False,,,0.0,0.0,0.0,1.0
